10 Piece Black Oval Brush Set,https://techinstr.myshopify.com//collections/all/products/10-piece-black-oval-brush-set
1xPlastic Manual Balloon Pump Inflator Air Pillow for Party Decor Random Color,https://techinstr.myshopify.com//collections/all/products/1xplastic-manual-balloon-pump-inflator-air-pillow-for-party-decor-random-color
2-Pack Easy Microwave Egg Cooker,https://techinstr.myshopify.com//collections/all/products/2-pack-easy-microwave-egg-cooker
2-strip Velocity Elastic Elastica Bungee Rubber Band for Slingshot Catapult Hunting,https://techinstr.myshopify.com//collections/all/products/2-strip-velocity-elastic-elastica-bungee-rubber-band-for-slingshot-catapult-hunting-2
2.5L Ice Core Beer Dispenser Beverage Machine Ice Tube for Wine Alcohol Juice Soft Drink,https://techinstr.myshopify.com//collections/all/products/2-5l-ice-core-beer-dispenser-beverage-machine-ice-tube-for-wine-alcohol-juice-soft-drink
2016 women summer fashion chest wrap lace dress long sexy leak back beach dress,https://techinstr.myshopify.com//collections/all/products/2016-women-summer-fashion-chest-wrap-lace-dress-long-sexy-leak-back-beach-dress
2017 Fashion Watch Women PU Leather Quartz Wrist Watches Hour montre femme relogio feminino Dress Watch Lady #23,https://techinstr.myshopify.com//collections/all/products/2017-fashion-watch-women-pu-leather-quartz-wrist-watches-hour-montre-femme-relogio-feminino-dress-watch-lady-23
24 inch Confetti Balloons Party Clear Transparent ConfettiBalloons for Birthday Wedding Graduation Decoration,https://techinstr.myshopify.com//collections/all/products/24-inch-confetti-balloons-party-clear-transparent-confettiballoons-for-birthday-wedding-graduation-decoration
3PCs Clear Plastic Food Ice Salad Scoops Sugar Sweet Candy Shovel Bar Buffet Wedding Party Tools,https://techinstr.myshopify.com//collections/all/products/3pcs-clear-plastic-food-ice-salad-scoops-sugar-sweet-candy-shovel-bar-buffet-wedding-party-tools
4PCS Halloween Tricky Props Fake Frog Simulation Prop For Halloween April Fool's Day Mischief (Random Color),https://techinstr.myshopify.com//collections/all/products/4pcs-halloween-tricky-props-fake-frog-simulation-prop-for-halloween-april-fools-day-mischief-random-color
5000Pcs 3MM DIY Diamond Table Confetti Clear Crystal Events Party Accessories,https://techinstr.myshopify.com//collections/all/products/5000pcs-3mm-diy-diamond-table-confetti-clear-crystal-events-party-accessories
50pcs White Feathers with Gold Tips Dipped Natural White Feathers for Various Crafts Birthday Parties Wedding and Party Dress-ups,https://techinstr.myshopify.com//collections/all/products/50pcs-white-feathers-with-gold-tips-dipped-natural-white-feathers-for-various-crafts-birthday-parties-wedding-and-party-dress-ups
7 Chakra Healing Beaded Bracelet Natural Lava Stone Diffuser Bracelet Jewelry,https://techinstr.myshopify.com//collections/all/products/7-chakra-healing-beaded-bracelet-natural-lava-stone-diffuser-bracelet-jewelry
Adam 1,https://techinstr.myshopify.com//collections/all/products/adam-1
Automatic Toothpaste Dispenser 5 Toothbrush Holder Set Wall Mount Stand toothbrush Family Set Auto Toothpaste Dispenser Squeezer,https://techinstr.myshopify.com//collections/all/products/automatic-toothpaste-dispenser-5-toothbrush-holder-set-wall-mount-stand-toothbrush-family-set-auto-toothpaste-dispenser-squeezer
Baby Girls Hair Tie Ribbon Bow Clips Barrettes Hair Accessory Set for Newborn Toddler Children 18Pcs Gift Box Silver,https://techinstr.myshopify.com//collections/all/products/baby-girls-hair-tie-ribbon-bow-clips-barrettes-hair-accessory-set-for-newborn-toddler-children-18pcs-gift-box-silver-2
BeddingOutlet Soft Cozy Velvet Plush Throw Blanket Rainbow Elephant Modern Line Art Sherpa Blanket for Couch Throw Travel,https://techinstr.myshopify.com//collections/all/products/beddingoutlet-soft-cozy-velvet-plush-throw-blanket-rainbow-elephant-modern-line-art-sherpa-blanket-for-couch-throw-travel
Bewitched Bewitched T Shirt,https://techinstr.myshopify.com//collections/all/products/bewitched-bewitched-t-shirt
Borgias Family Portrait T Shirt,https://techinstr.myshopify.com//collections/all/products/borgias-family-portrait-t-shirt
Brown + Black Gel Eyeliner,https://techinstr.myshopify.com//collections/all/products/brown-black-gel-eyeliner
Californication Hank Is My Hero T Shirt,https://techinstr.myshopify.com//collections/all/products/californication-hank-is-my-hero-t-shirt
Californication I Get Moody T Shirt,https://techinstr.myshopify.com//collections/all/products/californication-i-get-moody-t-shirt
Californication Smoker T Shirt,https://techinstr.myshopify.com//collections/all/products/californication-smoker-t-shirt
Charlies Angels I Believe T Shirt,https://techinstr.myshopify.com//collections/all/products/charlies-angels-i-believe-t-shirt
Charlies Angels I Only Answer To Charlie T Shirt,https://techinstr.myshopify.com//collections/all/products/charlies-angels-i-only-answer-to-charlie-t-shirt
Charlies Angels Trio Block T Shirt,https://techinstr.myshopify.com//collections/all/products/charlies-angels-trio-block-t-shirt
Cheers Norm T Shirt,https://techinstr.myshopify.com//collections/all/products/cheers-norm-t-shirt
"Creative DIY Build-on Brick Mug Lego Style Puzzle Mugs, Building Blocks Coffee Mug",https://techinstr.myshopify.com//collections/all/products/creative-diy-build-on-brick-mug-lego-style-puzzle-mugs-building-blocks-coffee-mug
Credit Card Holders PU Card Bus ID Holders Identity Badge Product,https://techinstr.myshopify.com//collections/all/products/credit-card-holders-pu-card-bus-id-holders-identity-badge-product
Criminal Minds Hotch T Shirt,https://techinstr.myshopify.com//collections/all/products/criminal-minds-hotch-t-shirt
Cute Halloween Head Band Pumpkin Hairband Pumpkin Hat Kids Children Witch Hat,https://techinstr.myshopify.com//collections/all/products/cute-halloween-head-band-pumpkin-hairband-pumpkin-hat-kids-children-witch-hat
Dawsons Creek Feelings T Shirt,https://techinstr.myshopify.com//collections/all/products/dawsons-creek-feelings-t-shirt
Dexter Good Bad T Shirt,https://techinstr.myshopify.com//collections/all/products/dexter-good-bad-t-shirt
Dexter Plastic Wrap T Shirt,https://techinstr.myshopify.com//collections/all/products/dexter-plastic-wrap-t-shirt
Dexter Splatter T Shirt,https://techinstr.myshopify.com//collections/all/products/dexter-splatter-t-shirt
Electric Face Cleanser Vibrate Pore Clean Silicone Cleansing Brush Massager Facial Vibration Skin Care Spa Massage,https://techinstr.myshopify.com//collections/all/products/electric-face-cleanser-vibrate-pore-clean-silicone-cleansing-brush-massager-facial-vibration-skin-care-spa-massage
Elegant breast cancer logo high - grade diamond AIDS pink ribbon brooch clothing accessories,https://techinstr.myshopify.com//collections/all/products/elegant-breast-cancer-logo-high-grade-diamond-aids-pink-ribbon-brooch-clothing-accessories-1
European Pastoral Style Hollow LOVE Floor Lamp Candle Holder Vase Storage Bucket For Wedding Party DIY Home decoration,https://techinstr.myshopify.com//collections/all/products/european-pastoral-style-hollow-love-floor-lamp-candle-holder-vase-storage-bucket-for-wedding-party-diy-home-decoration
Facial Face Mask Sheet Essence Replenishment Moisture Mask Cosmetics,https://techinstr.myshopify.com//collections/all/products/facial-face-mask-sheet-essence-replenishment-moisture-mask-cosmetics
Fashion Print Street Style Men Jacket,https://techinstr.myshopify.com//collections/all/products/fashion-print-street-style-men-jacket
Female Yarn Without A Trace of Ultra thin Ladies Sexy Pure Color Low Waist,https://techinstr.myshopify.com//collections/all/products/female-yarn-without-a-trace-of-ultra-thin-ladies-sexy-pure-color-low-waist
Floral Baby Girl Princess Bridesmaid Pageant Gown Birthday Party Wedding Dress,https://techinstr.myshopify.com//collections/all/products/floral-baby-girl-princess-bridesmaid-pageant-gown-birthday-party-wedding-dress
Foldable Aluminum 8' Folding Beer Pong Table,https://techinstr.myshopify.com//collections/all/products/foldable-aluminum-8-folding-beer-pong-table
Geneva Watch Women Fashion 2017 Casual Quartz Watches PU Leather Men's Watches Business Style Wristwatches relogio masculino #53,https://techinstr.myshopify.com//collections/all/products/geneva-watch-women-fashion-2017-casual-quartz-watches-pu-leather-mens-watches-business-style-wristwatches-relogio-masculino-53
Good Grips 3-in-1 Avocado Slicer,https://techinstr.myshopify.com//collections/all/products/good-grips-3-in-1-avocado-slicer
Grandmother Love Daughter Leather Strap Bracelet,https://techinstr.myshopify.com//collections/all/products/grandmother-love-daughter-leather-strap-bracelet
Hair Styling Hair Bun Maker Clip Curler Roller Tool Hair Donut Former for Girl Ladies Magic DIY Hair Tool,https://techinstr.myshopify.com//collections/all/products/hair-styling-hair-bun-maker-clip-curler-roller-tool-hair-donut-former-for-girl-ladies-magic-diy-hair-tool
Halloween Cosplay Mask Horrific Mask Creepy Terrifying Toothy Flame Clown Mask,https://techinstr.myshopify.com//collections/all/products/halloween-cosplay-mask-horrific-mask-creepy-terrifying-toothy-flame-clown-mask
Halloween Demon Cat Pullovers,https://techinstr.myshopify.com//collections/all/products/halloween-demon-cat-pullovers
"Happy Wife Happy Life Tie Dye Tee Shirt - Woodstock, Small",https://techinstr.myshopify.com//collections/all/products/happy-wife-happy-life-tie-dye-tee-shirt-woodstock-small
High Quality Metal Shiny Card Holder Wallet,https://techinstr.myshopify.com//collections/all/products/high-quality-metal-shiny-card-holder-wallet
Horse Head Mask Animal Costume n Toys Party Halloween,https://techinstr.myshopify.com//collections/all/products/horse-head-mask-animal-costume-n-toys-party-halloween
Hot Selling Creative Stainless Steel Fruit Pineapple Corer Slicers Peeler Parer Cutter Kitchen Tool,https://techinstr.myshopify.com//collections/all/products/hot-selling-creative-stainless-steel-fruit-pineapple-corer-slicers-peeler-parer-cutter-kitchen-tool-1
I Dream Of Jeannie Jeannie Paint T Shirt,https://techinstr.myshopify.com//collections/all/products/i-dream-of-jeannie-jeannie-paint-t-shirt
I Dream Of Jeannie Think And Blink T Shirt,https://techinstr.myshopify.com//collections/all/products/i-dream-of-jeannie-think-and-blink-t-shirt
Latex Full Head Toothy Monster Mask Scary Creepy Devil Mask for Halloween Masquerade Costume Cosplay Party Props,https://techinstr.myshopify.com//collections/all/products/latex-full-head-toothy-monster-mask-scary-creepy-devil-mask-for-halloween-masquerade-costume-cosplay-party-props
LED Night Light 3D Printing Moon Lamp Dimmable Touch Control USB Charging Light,https://techinstr.myshopify.com//collections/all/products/led-night-light-3d-printing-moon-lamp-dimmable-touch-control-usb-charging-light
Luxury Edition Black Scrape World Map Deluxe Travel Scratch Map Travel Map Poster Scratch Off World Map Gift for Traveler,https://techinstr.myshopify.com//collections/all/products/luxury-edition-black-scrape-world-map-deluxe-travel-scratch-map-travel-map-poster-scratch-off-world-map-gift-for-traveler
M L XL XXL 3XL 4XL 5XL plus size cotton casual autumn 2018 women dress long sleeve big size navy blue striped loose midi female #OM8261,https://techinstr.myshopify.com//collections/all/products/m-l-xl-xxl-3xl-4xl-5xl-plus-size-cotton-casual-autumn-2018-women-dress-long-sleeve-big-size-navy-blue-striped-loose-midi-female-om8261
Magda 1,https://techinstr.myshopify.com//collections/all/products/magda-1
Magic Rainbow Racetrack - Glow In The Dark,https://techinstr.myshopify.com//collections/all/products/magic-rainbow-racetrack-glow-in-the-dark
Maxi Black Pink Flowers Skirt,https://techinstr.myshopify.com//collections/all/products/maxi-black-pink-flowers-skirt
Men Outdoor Warm Winter Thick Jacket Plus Fur Hooded Coat Jacket,https://techinstr.myshopify.com//collections/all/products/men-outdoor-warm-winter-thick-jacket-plus-fur-hooded-coat-jacket
Men's Casual Sport LED Watches Digital Military Wristwatch Digital Watch,https://techinstr.myshopify.com//collections/all/products/mens-casual-sport-led-watches-digital-military-wristwatch-digital-watch-1
Mighty Mouse Here I Come T Shirt,https://techinstr.myshopify.com//collections/all/products/mighty-mouse-here-i-come-t-shirt
Mini Portable LCD LED Projector Full HD 1080P,https://techinstr.myshopify.com//collections/all/products/mini-portable-lcd-led-projector-full-hd-1080p
Mini WiFi USB Signal Booster,https://techinstr.myshopify.com//collections/all/products/mini-wifi-usb-signal-booster-1
Multi-functional Magnetic Car Phone Holder 360° Rotation,https://techinstr.myshopify.com//collections/all/products/multi-functional-magnetic-car-phone-holder-360-rotation
Natural Beauty  Dense A Pair False Eyelashes,https://techinstr.myshopify.com//collections/all/products/natural-beauty-dense-a-pair-false-eyelashes
Ncis Strange T Shirt,https://techinstr.myshopify.com//collections/all/products/ncis-strange-t-shirt
Ncis The Boss T Shirt,https://techinstr.myshopify.com//collections/all/products/ncis-the-boss-t-shirt
New Arrival Mens Motorcycle Leather Jacket,https://techinstr.myshopify.com//collections/all/products/new-arrival-mens-motorcycle-leather-jacket
NEW Black Mud Deep Cleansing  Blackhead Remover Purifying Peel Face Mask,https://techinstr.myshopify.com//collections/all/products/new-black-mud-deep-cleansing-blackhead-remover-purifying-peel-face-mask
NEW Fashion Women Multilayer Alloy Pendant Necklace Chain Jewelry,https://techinstr.myshopify.com//collections/all/products/new-fashion-women-multilayer-alloy-pendant-necklace-chain-jewelry
New Landscaping Decoration Heart Shaped Stickers 12 Butterfly Stickers,https://techinstr.myshopify.com//collections/all/products/new-landscaping-decoration-heart-shaped-stickers-12-butterfly-stickers
New Posture Corrector Shoulder Bandage Corset Back Orthopedic Brace Scoliosis Back Support Belt for Man Woman,https://techinstr.myshopify.com//collections/all/products/new-posture-corrector-shoulder-bandage-corset-back-orthopedic-brace-scoliosis-back-support-belt-for-man-woman
New Stainless Steel Ring Titanium Silver Black Gold,https://techinstr.myshopify.com//collections/all/products/new-stainless-steel-ring-titanium-silver-black-gold
Newborn Toddler Baby Girls Boys Camouflage Bow Tops Pants Outfits Set Clothes,https://techinstr.myshopify.com//collections/all/products/newborn-toddler-baby-girls-boys-camouflage-bow-tops-pants-outfits-set-clothes
Nurse Jackie Life Is Full T Shirt,https://techinstr.myshopify.com//collections/all/products/nurse-jackie-life-is-full-t-shirt
Official Bullstate Regulation Cornhole Set (Pyramid),https://techinstr.myshopify.com//collections/all/products/official-bullstate-regulation-cornhole-set-pyramid
Official Kentstate Regulation Cornhole Set (Swoosh),https://techinstr.myshopify.com//collections/all/products/official-kentstate-regulation-cornhole-set-swoosh
One Piece No Clip Hair Extensions Long Straight Hairpiece Adjustable Hidden Transparent Wire Synthetic Fiber Hairpieces,https://techinstr.myshopify.com//collections/all/products/one-piece-no-clip-hair-extensions-long-straight-hairpiece-adjustable-hidden-transparent-wire-synthetic-fiber-hairpieces-2
Original ColorShift Egg Timer,https://techinstr.myshopify.com//collections/all/products/original-colorshift-egg-timer
Outdoor Pet Collar TPE Insect Mosquito Flea Prevention Adjustable Outdoor Dog Neck Supplies,https://techinstr.myshopify.com//collections/all/products/outdoor-pet-collar-tpe-insect-mosquito-flea-prevention-adjustable-outdoor-dog-neck-supplies-1
Plain Knitted Cotton Hats For Newborn Baby Cute Solid Skullies Beanies Crochet Caps Girls Boy Warm Autumn Soft Hat Kids Knit Cap,https://techinstr.myshopify.com//collections/all/products/plain-knitted-cotton-hats-for-newborn-baby-cute-solid-skullies-beanies-crochet-caps-girls-boy-warm-autumn-soft-hat-kids-knit-cap
Portable & Rechargeable USB Fan,https://techinstr.myshopify.com//collections/all/products/portable-rechargeable-usb-fan
Portable Mini DV MD80 DVR Sport Video Camera Hidden Spy Video Recorder Digital Camera with USB Cord,https://techinstr.myshopify.com//collections/all/products/portable-mini-dv-md80-dvr-sport-video-camera-hidden-spy-video-recorder-digital-camera-with-usb-cord
PU Leather Jacket with Zipper,https://techinstr.myshopify.com//collections/all/products/pu-leather-jacket-with-zipper
Queer As Folk Cast T Shirt,https://techinstr.myshopify.com//collections/all/products/queer-as-folk-cast-t-shirt
Queer As Folk Logo T Shirt,https://techinstr.myshopify.com//collections/all/products/queer-as-folk-logo-t-shirt
Scratch World Map Travel Edition Original 42 * 30cm,https://techinstr.myshopify.com//collections/all/products/scratch-world-map-travel-edition-original-42-30cm
Sexy Women Floral Printed Long Dress Sleeveless Party Evening Beach Maxi Dress,https://techinstr.myshopify.com//collections/all/products/sexy-women-floral-printed-long-dress-sleeveless-party-evening-beach-maxi-dress
SHEIN Casual Leggings Women Fitness Leggings Color Block Autumn Winter Workout Pants New Arrival Mesh Insert Leggings,https://techinstr.myshopify.com//collections/all/products/shein-casual-leggings-women-fitness-leggings-color-block-autumn-winter-workout-pants-new-arrival-mesh-insert-leggings
SHEIN Pearl and Rhinestone Embellished Leggings Fitness Women Solid Black Casual Autumn 2017 Womens Leggings Pants,https://techinstr.myshopify.com//collections/all/products/shein-pearl-and-rhinestone-embellished-leggings-fitness-women-solid-black-casual-autumn-2017-womens-leggings-pants
Simplee Ruffle knitted sweater female Butterfly sleeve winter 2018 slim fit pullover streetwear jumper pull femme peplum top,https://techinstr.myshopify.com//collections/all/products/simplee-ruffle-knitted-sweater-female-butterfly-sleeve-winter-2018-slim-fit-pullover-streetwear-jumper-pull-femme-peplum-top
Simplee Waistband lace up knitted sweater women jersey Round neck casual knitting jumper Winter sweater pullover female 2017,https://techinstr.myshopify.com//collections/all/products/simplee-waistband-lace-up-knitted-sweater-women-jersey-round-neck-casual-knitting-jumper-winter-sweater-pullover-female-2017
Spring Summer 2017 Fashion Women Blouses Hanging Neck Long sleeve Sexy V-Neck Shirt Top Casual Gray Loose Ladies Blusas,https://techinstr.myshopify.com//collections/all/products/spring-summer-2017-fashion-women-blouses-hanging-neck-long-sleeve-sexy-v-neck-shirt-top-casual-gray-loose-ladies-blusas
Sterling Silver Bypass Leaf Ring,https://techinstr.myshopify.com//collections/all/products/sterling-silver-bypass-leaf-ring
Sterling Silver Diamond Cut Unicorn with Flowers Earrings,https://techinstr.myshopify.com//collections/all/products/sterling-silver-diamond-cut-unicorn-with-flowers-earrings
Sterling Silver French Wire (10 Pair),https://techinstr.myshopify.com//collections/all/products/sterling-silver-french-wire-10-pair
"Sterling Silver Lower Case Letter ""u"" Initial Charm",https://techinstr.myshopify.com//collections/all/products/sterling-silver-lower-case-letter-u-initial-charm
Sterling Silver Marcasite Irish Shamrock Ring,https://techinstr.myshopify.com//collections/all/products/sterling-silver-marcasite-irish-shamrock-ring
Sterling Silver Square Peridot Pendant with Pave Set White Topaz Twist Bail,https://techinstr.myshopify.com//collections/all/products/sterling-silver-square-peridot-pendant-with-pave-set-white-topaz-twist-bail
Sterling Silver Tiny Butterfly Ring with Scroll Band,https://techinstr.myshopify.com//collections/all/products/sterling-silver-tiny-butterfly-ring-with-scroll-band
Sterling Silver Two-tone Sand Dollar Bangle Bracelet (hook Closure),https://techinstr.myshopify.com//collections/all/products/sterling-silver-two-tone-sand-dollar-bangle-bracelet-hook-closure
Survivor Heroes Vs Villains T Shirt,https://techinstr.myshopify.com//collections/all/products/survivor-heroes-vs-villains-t-shirt
Sweettreats Non-stick Copper Skillet with Ceramic Coating and Induction cooker Dishwasher safe,https://techinstr.myshopify.com//collections/all/products/sweettreats-non-stick-copper-skillet-with-ceramic-coating-and-induction-cooker-dishwasher-safe
Sweettreats Non-stick Copper Skillet with Ceramic Coating and Induction cooker Dishwasher safe,https://techinstr.myshopify.com//collections/all/products/sweettreats-non-stick-copper-skillet-with-ceramic-coating-and-induction-cooker-dishwasher-safe-1
Swimwear Women Bikini Push Up Brazilian 2017 Sexy Pink Low Waist Female Bathing Suit With Pad Halter Bandage Micro Bikini Set EB,https://techinstr.myshopify.com//collections/all/products/swimwear-women-bikini-push-up-brazilian-2017-sexy-pink-low-waist-female-bathing-suit-with-pad-halter-bandage-micro-bikini-set-eb
Tassels Baby Moccasin Newborn Baby Shoes Soft Bottom PU Leather Prewalkers 0-18M,https://techinstr.myshopify.com//collections/all/products/tassels-baby-moccasin-newborn-baby-shoes-soft-bottom-pu-leather-prewalkers-0-18m
The L Word Chart T Shirt,https://techinstr.myshopify.com//collections/all/products/the-l-word-chart-t-shirt
The Love Between Aunt and Niece is Forever-HSB,https://techinstr.myshopify.com//collections/all/products/the-love-between-aunt-and-niece-is-forever-hsb
Toddler Newborn Baby Girls Letter Rompers Jumpsuit Flowers Pants 4PCS Outfit Set,https://techinstr.myshopify.com//collections/all/products/toddler-newborn-baby-girls-letter-rompers-jumpsuit-flowers-pants-4pcs-outfit-set
Two 10-Foot Cables for iPhone 4/5/6 and Android,https://techinstr.myshopify.com//collections/all/products/two-10-foot-cables-for-iphone-4-5-6-and-android
Vintage Double Heart Bracelet,https://techinstr.myshopify.com//collections/all/products/vintage-double-heart-bracelet
Warm Winter Hooded Fur Jacket,https://techinstr.myshopify.com//collections/all/products/warm-winter-hooded-fur-jacket
WiFi Genius Repeater - Instantly Double Your WiFi Range,https://techinstr.myshopify.com//collections/all/products/wifi-genius-repeater-instantly-double-your-wifi-range
Women Autumn Long Sleeve Slim V Neck Buttons Blouse Tops Shirt Tee,https://techinstr.myshopify.com//collections/all/products/women-autumn-long-sleeve-slim-v-neck-buttons-blouse-tops-shirt-tee
Women Bikini Swimsuit Sexy Two Pieces Paded Swimwear Push Up Swim Suit for Beach Swimming Pool Party,https://techinstr.myshopify.com//collections/all/products/women-bikini-swimsuit-sexy-two-pieces-paded-swimwear-push-up-swim-suit-for-beach-swimming-pool-party
Women Casual Chiffon O-Neck Sexy Sleeveless Print Beach Mini Party Dress,https://techinstr.myshopify.com//collections/all/products/women-casual-chiffon-o-neck-sexy-sleeveless-print-beach-mini-party-dress
Women Clubwear Casual Outfit Autumn And Winter Long Sleeves Top,https://techinstr.myshopify.com//collections/all/products/women-clubwear-casual-outfit-autumn-and-winter-long-sleeves-top
Women Plaid Patchwork Polka Dot Long Sleeve T-Shirt O-neck Pullover Blouse Tops,https://techinstr.myshopify.com//collections/all/products/women-plaid-patchwork-polka-dot-long-sleeve-t-shirt-o-neck-pullover-blouse-tops
Women Round Neck Long Sleeve Letter Print Casual Sweatshirt Pullover,https://techinstr.myshopify.com//collections/all/products/women-round-neck-long-sleeve-letter-print-casual-sweatshirt-pullover
Women Sexy Printing Buttons Off Shoulder Sleeveless Dress Princess Dress,https://techinstr.myshopify.com//collections/all/products/women-sexy-printing-buttons-off-shoulder-sleeveless-dress-princess-dress
Women Sexy Printing Buttons Off Shoulder Sleeveless Dress Princess Dress,https://techinstr.myshopify.com//collections/all/products/women-sexy-printing-buttons-off-shoulder-sleeveless-dress-princess-dress-1
women socks 2017 Fashion Girls Lace Antiskid Invisible Liner Ultra-thin Elastic Low Cut Socks calcetines divertidos,https://techinstr.myshopify.com//collections/all/products/women-socks-2017-fashion-girls-lace-antiskid-invisible-liner-ultra-thin-elastic-low-cut-socks-calcetines-divertidos
Women Summer Hollow Blouse Solid Short Sleeve Tops Sexy Party Skirt Two Sets,https://techinstr.myshopify.com//collections/all/products/women-summer-hollow-blouse-solid-short-sleeve-tops-sexy-party-skirt-two-sets
Women Summer Hollow Blouse Solid Short Sleeve Tops Sexy Party Skirt Two Sets,https://techinstr.myshopify.com//collections/all/products/women-summer-hollow-blouse-solid-short-sleeve-tops-sexy-party-skirt-two-sets-1
